{
  "formatVersion": "1.0.0",
  "source": "https://chainid.network/chains_mini.json",
  "chainIds": [
    1,
    11155111
  ],
  "entries": [
    {
      "chainId": 1,
      "name": "Ethereum Mainnet",
      "nativeCurrency": {
        "name": "Ether",
        "symbol": "ETH",
        "decimals": 18
      }
    },
    {
      "chainId": 11155111,
      "name": "Ethereum Sepolia",
      "nativeCurrency": {
        "name": "Sepolia Ether",
        "symbol": "ETH",
        "decimals": 18
      }
    }
  ]
}
